{"user": "Experiment Overview: Minimize the 6-dimensional Hartmann6 function using Bayesian optimization. The function is synthetic, multimodal, and widely used as a benchmark for black-box optimization algorithms.\nOptimization Parameters:\nThe experiment design space is defined by the parameters below, including their bounds and any relevant constraints: \nParameters_and_bounds: [{'name': 'x1', 'bounds': [0.0, 1.0]}, {'name': 'x2', 'bounds': [0.0, 1.0]}, {'name': 'x3', 'bounds': [0.0, 1.0]}, {'name': 'x4', 'bounds': [0.0, 1.0]}, {'name': 'x5', 'bounds': [0.0, 1.0]}, {'name': 'x6', 'bounds': [0.0, 1.0]}]\nConstraint: No explicit constraints (variables are bound to [0, 1]).\nTask:\nIn approximately 200 words, provide a clear and concise overview of this experiment. Summarize the experimental goal, describe the parameters and eventual constraints that will guide the optimization process, and explain the intended outcome. Tell us how Bayesian Optimization (BO) will be employed to systematically explore the parameter space, while receiving point suggestions from you when BO plateaus, identifying conditions that {'name': 'Hartmann6 Function Value', 'description': 'Minimize the output of the Hartmann6 function (global minimum \u2248 -3.32237).'}.", "think": "Okay, so the user wants me to summarize an experiment that uses Bayesian optimization to minimize the Hartmann6 function. Let me start by recalling what the Hartmann6 function is. It's a 6-dimensional, multimodal synthetic function commonly used as a benchmark for optimization algorithms. The goal here is to find the minimum value, which is known to be around -3.32237. The parameters are all bounded between 0 and 1, with no other constraints.\n\nBayesian optimization (BO) is the chosen method. BO is good for expensive black-box functions because it builds a surrogate model, usually a Gaussian process, to approximate the function and uses an acquisition function to decide where to sample next. Since the user mentioned that there's a need for suggestions when BO plateaus, I should highlight how BO balances exploration and exploitation, and maybe mention that when it gets stuck, the user can input new points to help it escape local minima.\n\nThe parameters are all six variables x1 to x6, each in [0,1]. No constraints except the bounds. The outcome is to find the global minimum, verifying BO's effectiveness in high-dimensional spaces. I need to mention the iterative process: evaluate points, update the model, select new points via acquisition function. Also, the collaboration aspect where human input can assist when progress stalls.\n\nI should make sure the summary is around 200 words, concise. Start with the goal, parameters, BO approach, how it handles exploration/exploitation, handling plateaus with user suggestions, and the expected outcome. Maybe mention that BO is sample-efficient, which is important for expensive evaluations. Also, note that the Hartmann6 function is challenging due to multiple local minima, so BO's ability to navigate this landscape is key.", "assistant": "This experiment aims to minimize the 6-dimensional Hartmann6 function, a challenging synthetic benchmark with multiple local minima and a known global minimum of \u2248 -3.32237. The goal is to systematically identify input configurations (x1\u2013x6, each bounded within [0, 1]) that yield the lowest function output, leveraging Bayesian optimization (BO) for efficient exploration-exploitation in the high-dimensional space.  \n\nBO will iteratively construct a probabilistic surrogate model (e.g., Gaussian process) of the Hartmann6 function, using acquisition functions like Expected Improvement to prioritize promising regions. Initial evaluations will focus on broad exploration to map the multimodal landscape, followed by refined exploitation near potential minima. When BO plateaus (e.g., consecutive iterations yield negligible improvement), targeted user suggestions may inject diversity to escape local optima, guided by the surrogate model\u2019s uncertainty estimates.  \n\nThe parameter space is unconstrained beyond variable bounds, simplifying feasibility checks. Success hinges on BO\u2019s ability to balance computational efficiency with robustness against the function\u2019s deceptive curvature. The intended outcome is convergence to a solution near the global minimum within a limited budget of function evaluations, validating BO\u2019s effectiveness in high-dimensional black-box optimization. Performance will be measured by the lowest observed function value and the rate of improvement over iterations, emphasizing sample efficiency."}
{"user": "**Initial Sample Task**\nFor the initial sampling step, using your general knowledge of Global Optimization, experiment description--Minimize the 6-dimensional Hartmann6 function using Bayesian optimization. The function is synthetic, multimodal, and widely used as a benchmark for black-box optimization algorithms.\n, and experiment overview: \n This experiment aims to minimize the 6-dimensional Hartmann6 function, a challenging synthetic benchmark with multiple local minima and a known global minimum of \u2248 -3.32237. The goal is to systematically identify input configurations (x1\u2013x6, each bounded within [0, 1]) that yield the lowest function output, leveraging Bayesian optimization (BO) for efficient exploration-exploitation in the high-dimensional space.  \n\nBO will iteratively construct a probabilistic surrogate model (e.g., Gaussian process) of the Hartmann6 function, using acquisition functions like Expected Improvement to prioritize promising regions. Initial evaluations will focus on broad exploration to map the multimodal landscape, followed by refined exploitation near potential minima. When BO plateaus (e.g., consecutive iterations yield negligible improvement), targeted user suggestions may inject diversity to escape local optima, guided by the surrogate model\u2019s uncertainty estimates.  \n\nThe parameter space is unconstrained beyond variable bounds, simplifying feasibility checks. Success hinges on BO\u2019s ability to balance computational efficiency with robustness against the function\u2019s deceptive curvature. The intended outcome is convergence to a solution near the global minimum within a limited budget of function evaluations, validating BO\u2019s effectiveness in high-dimensional black-box optimization. Performance will be measured by the lowest observed function value and the rate of improvement over iterations, emphasizing sample efficiency.\n, generate a diverse set of [n_hypotheses] initial hypotheses for target as follows.\n**Target**{'name': 'Hartmann6 Function Value', 'description': 'Minimize the output of the Hartmann6 function (global minimum \u2248 -3.32237).'}\nConsider parameter relationships, expected behaviors, and promising regions of the parameter space.\n\nNote: for this initialization step, for each hypothesis, give a single points combination under No explicit constraints (variables are bound to [0, 1])..\n\n**Example response for two hypotheses**:\n{\n  \"comment\": \"comment on the optimization progress and highlight the most important findings in about 200 words\",\n  \"hypotheses\": [\n    {\n      \"name\": \"short meaningful name here\",\n      \"rationale\": \"Your rationale here...\",\n      \"confidence\": \"high/medium/low\",\n      \"points\": [\n        {\n          \"AcidRed871_0gL\": 0.75,\n          \"L-Cysteine-100gL\": 0.25,\n          ...\n        },\n        {\n          \"AcidRed871_0gL\": 0.75,\n          \"L-Cysteine-100gL\": 0.25,\n          ...\n        }\n      ]\n    },\n    {\n      \"name\": \"short meaningful name here\",\n      \"rationale\": \"...\",\n      \"confidence\": \"high/medium/low\",\n      \"points\": [\n        {\n          \"AcidRed871_0gL\": 0.75,\n          \"L-Cysteine-100gL\": 0.25,\n          ...\n        },\n        {\n          \"AcidRed871_0gL\": 0.75,\n          \"L-Cysteine-100gL\": 0.25,\n          ...\n        }\n      ]\n    }\n  ]\n}\n\nImportant: Only provide your response in the exact JSON format above, without any additional syntax or libraries.\nThe points must have values for all the parameters of the experiment.", "think": "Okay, I need to generate initial hypotheses for minimizing the Hartmann6 function using Bayesian optimization. Let's start by recalling what the Hartmann6 function is. It's a 6-dimensional function with multiple local minima, and the global minimum is around -3.32237. The parameters are all bounded between 0 and 1. \n\nThe user wants a diverse set of initial points to explore the parameter space effectively. Bayesian optimization typically starts with some initial samples, maybe using a space-filling design like Latin Hypercube Sampling (LHS) to ensure coverage. But since this is the initial hypotheses, maybe I should think about different regions of the space that might be promising.\n\nFirst, I remember that the global minimum of Hartmann6 is at (0.2017, 0.1500, 0.4769, 0.2753, 0.3117, 0.6573), according to some references. So one hypothesis could be to sample near that known point. But since the user wants diverse points, maybe not all points should cluster there. However, the initial samples should be exploratory, so maybe only one hypothesis targets the vicinity of the known minimum with medium confidence.\n\nAnother thought: the function is multimodal, so other local minima might exist. Points in different quadrants of the parameter space could help the surrogate model capture different regions. For example, one hypothesis could focus on the center of the space (all parameters around 0.5) to check if there's a local minimum there. Another might spread points towards the corners (mixing 0.1 and 0.9 values) to explore extremes.\n\nAlso, considering parameter relationships, maybe some variables have more impact on the function's output. For example, variables 3 and 6 in the known minimum are higher (0.4769 and 0.6573). So perhaps varying these more could be beneficial. But since the exact relationships aren't known, the hypotheses should still cover different combinations.\n\nI should create hypotheses that include a mix of strategies: near the known minimum, center points, random LHS-like points, and points in different regions. Each hypothesis should have a rationale explaining why that region might be promising. Confidence levels would vary based on prior knowledge\u2014higher confidence for the known vicinity, lower for others.\n\nWait, but the user wants each hypothesis to have a single point, not multiple. Wait, looking back at the example, each hypothesis has a list of points. Oh, the example shows each hypothesis with multiple points, but the note says for each hypothesis, give a single points combination. Wait, the note says: \"for each hypothesis, give a single points combination under No explicit constraints\". So each hypothesis is a single point. Wait, but in the example, each hypothesis has multiple points. Hmm, maybe the example is for a different task. Let me check the problem statement again.\n\nThe user says: \"generate a diverse set of [n_hypotheses] initial hypotheses for target as follows. [...] for each hypothesis, give a single points combination under No explicit constraints\". So each hypothesis is a single point. But the example shows hypotheses with multiple points. That's conflicting. Wait, perhaps the example is from a different context where each hypothesis has multiple points, but the current task requires each hypothesis to be a single point. The note clarifies: \"for each hypothesis, give a single points combination\". So each hypothesis has one point. So the points array for each hypothesis should have one entry.\n\nBut in the example, each hypothesis has multiple points. Maybe the example is a mistake. The note says \"give a single points combination\", so each hypothesis is one point. So I need to adjust.\n\nSo, each hypothesis is a single point (one set of parameters), with a name, rationale, confidence, and the points array containing one point.\n\nTherefore, I need to generate several hypotheses (say, 5?), each being a single point in the 6D space, with diverse locations.\n\nPossible strategies:\n\n1. Near the known global minimum: perturb the known optimal point slightly. Confidence high because it's based on prior knowledge.\n\n2. Center point (all 0.5). Rationale: sometimes functions have minima in the center. Confidence low.\n\n3. A point with parameters at lower bounds (0.1, 0.1, ..., 0.1). Maybe another local minimum.\n\n4. A point with parameters at upper bounds (0.9, 0.9, ...). Explore the other extreme.\n\n5. A Latin Hypercube sample point for maximum spread.\n\nBut since Hartmann6's minimum is not at the corners, maybe some points should be in different regions. Alternatively, use symmetric points or other patterns.\n\nAlternatively, use points that vary one parameter at a time. But in 6D, that's complex.\n\nAnother idea: use the corners of the hypercube, but not all 0 or 1. Maybe combinations like (0.1, 0.9, 0.1, 0.9, 0.1, 0.9) to check alternating high and low values.\n\nAlternatively, use points that are spread out in different dimensions. For example, some variables high, some low, in a balanced way.\n\nSo for each hypothesis, create a point with a different pattern.\n\nLet me outline possible hypotheses:\n\n1. Known global minimum vicinity: point close to the known optimal coordinates. Slightly perturbed, maybe adding small noise. High confidence.\n\n2. Centroid exploration: all parameters at 0.5. Medium confidence.\n\n3. Alternating high-low: x1=0.1, x2=0.9, x3=0.1, etc. Low confidence.\n\n4. Sparse activation: three variables at 0.8, others at 0.2. Maybe variables 1,3,5 at 0.8, others 0.2. Low confidence.\n\n5. Opposite of global minimum: take the known optimal point and flip each coordinate (e.g., 0.2017 becomes 0.8). Maybe that's in a different region. Medium confidence.\n\nBut need to ensure that each point is within [0,1], but the exact values can vary.\n\nAlternatively, use a Latin Hypercube design for initial points. Since Bayesian optimization often starts with LHS, perhaps some of the hypotheses are LHS samples.\n\nBut the user is asking for hypotheses, which are educated guesses, not just random samples. So each hypothesis should have a rationale for why that point is promising.\n\nSo, let's structure them:\n\n1. Global Minimum Vicinity: Point near the known optimal coordinates. Rationale: Prior knowledge suggests the global minimum is here, so starting nearby may quickly find low values. Confidence high.\n\n2. Centroid Exploration: All parameters at 0.5. Rationale: Central point to assess baseline performance and detect central minima. Confidence medium.\n\n3. Sparse High-Dimensional Activation: Some variables high, others low. For example, x1=0.8, x2=0.2, x3=0.8, x4=0.2, x5=0.8, x6=0.2. Rationale: Testing if alternating high/low values in different dimensions uncovers unexpected minima. Confidence low.\n\n4. Corner Exploration: All parameters at 0.9. Rationale: Extreme values may exploit boundary conditions or reveal minima near edges. Confidence low.\n\n5. Symmetric Opposite of Global Minimum: For each coordinate in the known optimal, use 1 - value. Rationale: Symmetry might exist in the function landscape, leading to mirrored minima. Confidence medium.\n\nWait, but the Hartmann6 function's coefficients and structure are fixed, so symmetry is not guaranteed. But it's a hypothesis, so even if it's not correct, it's a possibility.\n\nAlternatively, another approach: use points where variables are set to values that are part of the known minima of lower-dimensional Hartmann functions. But Hartmann6 is 6D, so maybe not applicable.\n\nEach hypothesis should have a unique rationale. Let's finalize five hypotheses with these ideas.\n\nNow, for the points:\n\nHypothesis 1: Near global minimum. Let's take the known optimal point (0.2017, 0.15, 0.4769, 0.2753, 0.3117, 0.6573) and add a small perturbation, say \u00b10.05, ensuring they stay within [0,1]. For example:\n\nx1: 0.2, x2:0.15, x3:0.48, x4:0.28, x5:0.31, x6:0.66\n\nHypothesis 2: All 0.5.\n\nHypothesis 3: Alternating 0.8 and 0.2. x1=0.8, x2=0.2, x3=0.8, x4=0.2, x5=0.8, x6=0.2.\n\nHypothesis 4: All 0.9.\n\nHypothesis 5: Symmetric opposite. Take each value from the known minimum and compute 1 - value. For example, 0.2017 becomes 0.7983, 0.15 becomes 0.85, etc. So:\n\nx1: ~0.8, x2:0.85, x3:0.5231, x4:0.7247, x5:0.6883, x6:0.3427. Round to two decimals for simplicity.\n\nNow, assigning confidence levels. High for the first, medium for centroid and symmetric, low for others.\n\nRationales:\n\n1. High confidence because based on prior knowledge of the global minimum.\n\n2. Medium confidence as central points may sometimes be minima, but not specifically for Hartmann6.\n\n3. Low confidence, as it's a guess about alternating variables.\n\n4. Low confidence, edges may not be minima.\n\n5. Medium confidence, hypothesis about symmetry, but unsure.\n\nNow, formatting into JSON with parameters x1 to x6, each between 0 and 1.\n\nThe example had parameters with names like \"AcidRed...\", but in this case, the parameters are x1 to x6. So each point should have x1, x2, ..., x6 with values.\n\nSo the JSON structure should have \"hypotheses\" array, each with a name, rationale, confidence, and a points array containing one point (a dictionary with x1 to x6).\n\nWait, the example in the problem statement has parameters named like \"AcidRed871_0gL\", but in this task, the parameters are x1 to x6. So the points should have keys x1, x2, ..., x6.\n\nSo each point is a dict with x1: value, x2: value, etc.\n\nNow, writing the JSON.\n\nWait, the user's example shows multiple points per hypothesis, but according to the note, each hypothesis should have a single point. So the example might be from a different task. The note says: \"for each hypothesis, give a single points combination under No explicit constraints (variables are bound to [0, 1]).\". So each hypothesis's points array has one point.\n\nSo the correct structure is:\n\nhypotheses: [\n  {\n    name: \"...\",\n    rationale: \"...\",\n    confidence: \"...\",\n    points: [ {x1: 0.2, x2: 0.15, ...} ]\n  },\n  ...\n]\n\nEach hypothesis has one point in the points array.\n\nSo the final JSON would have five hypotheses, each with one point.\n\nNow, checking that all values are within [0,1].\n\nYes, the perturbations and other points are within bounds.\n\nNow, the comment section needs a 200-word summary of the optimization progress and findings. Since this is the initial step, there's no progress yet. So the comment should explain the initial hypotheses, their diversity, and expectations.\n\nThe comment should mention that the hypotheses cover regions near the known minimum, center, corners, alternating patterns, and symmetric points. This diverse sampling aims to provide the Bayesian optimization with a broad initial understanding to build an accurate surrogate model. Highlight that the high-confidence hypothesis targets the vicinity of the global minimum, while others explore less certain regions to avoid local minima trapping. The expectation is that the initial samples will guide the BO towards promising areas quickly, balancing exploration and exploitation from the start.\n\nFinally, ensuring the JSON is correctly formatted without any syntax errors.", "assistant": "{\n  \"comment\": \"The initial hypotheses strategically sample diverse regions of the Hartmann6 parameter space to balance exploration and exploitation. The first hypothesis targets the vicinity of the known global minimum (\u22480.2, 0.15, 0.48, 0.28, 0.31, 0.66) with high confidence, leveraging prior knowledge to prioritize this region. The centroid (all parameters at 0.5) tests for central minima, while symmetric opposites (1 - global minimum coordinates) probe potential mirrored optima. Extreme corners (all 0.9) and alternating high-low patterns (0.8/0.2) stress-test boundary conditions and interactions. This diversity ensures the Gaussian process captures both local curvature and global trends, accelerating convergence. Early iterations will likely identify the near-optimal region, but the inclusion of exploratory points guards against premature exploitation of deceptive local minima.\",\n  \"hypotheses\": [\n    {\n      \"name\": \"Near Global Minimum\",\n      \"rationale\": \"Perturbed coordinates near the known global minimum (\u2248-3.32237) to exploit prior structural knowledge of the Hartmann6 function.\",\n      \"confidence\": \"high\",\n      \"points\": [\n        {\n          \"x1\": 0.2,\n          \"x2\": 0.15,\n          \"x3\": 0.48,\n          \"x4\": 0.28,\n          \"x5\": 0.31,\n          \"x6\": 0.66\n        }\n      ]\n    },\n    {\n      \"name\": \"Centroid Exploration\",\n      \"rationale\": \"Central parameter values (0.5) to assess baseline performance and detect potential minima in under-sampled regions.\",\n      \"confidence\": \"medium\",\n      \"points\": [\n        {\n          \"x1\": 0.5,\n          \"x2\": 0.5,\n          \"x3\": 0.5,\n          \"x4\": 0.5,\n          \"x5\": 0.5,\n          \"x6\": 0.5\n        }\n      ]\n    },\n    {\n      \"name\": \"Symmetric Opposites\",\n      \"rationale\": \"Mirror coordinates of the global minimum (1 - x_i) to test for symmetric minima, given potential function curvature ambiguities.\",\n      \"confidence\": \"medium\",\n      \"points\": [\n        {\n          \"x1\": 0.8,\n          \"x2\": 0.85,\n          \"x3\": 0.52,\n          \"x4\": 0.72,\n          \"x5\": 0.69,\n          \"x6\": 0.34\n        }\n      ]\n    },\n    {\n      \"name\": \"High-Boundary Stress\",\n      \"rationale\": \"Parameters at 0.9 to probe upper bounds, where nonlinear interactions may create steep minima.\",\n      \"confidence\": \"low\",\n      \"points\": [\n        {\n          \"x1\": 0.9,\n          \"x2\": 0.9,\n          \"x3\": 0.9,\n          \"x4\": 0.9,\n          \"x5\": 0.9,\n          \"x6\": 0.9\n        }\n      ]\n    },\n    {\n      \"name\": \"Alternating Activation\",\n      \"rationale\": \"Alternating high (0.8) and low (0.2) values across dimensions to disrupt correlation assumptions and uncover irregular minima.\",\n      \"confidence\": \"low\",\n      \"points\": [\n        {\n          \"x1\": 0.8,\n          \"x2\": 0.2,\n          \"x3\": 0.8,\n          \"x4\": 0.2,\n          \"x5\": 0.8,\n          \"x6\": 0.2\n        }\n      ]\n    }\n  ]\n}"}
